pathwaysNames	netSize	subnetSize	subnetScore	pvalues	qvalues	geneListEntrez	url
Regulation of FZD by ubiquitination	20	3	2.89288113854607	0.543910026322087	0.221256235115954	54894;340419;4041	http://www.ncbi.nlm.nih.gov/gene/?term= 54894+340419+4041
Regulation of gap junction activity	0	NA	NA	NA	NA		http://www.ncbi.nlm.nih.gov/gene/?term= 
Regulation of gene expression by Hypoxia-inducible Factor	0	NA	NA	NA	NA		http://www.ncbi.nlm.nih.gov/gene/?term= 
Regulation of gene expression in beta cells	0	NA	NA	NA	NA		http://www.ncbi.nlm.nih.gov/gene/?term= 
Regulation of gene expression in early pancreatic precursor cells	0	NA	NA	NA	NA		http://www.ncbi.nlm.nih.gov/gene/?term= 
Regulation of gene expression in endocrine-committed (NEUROG3+) progenitor cells	0	NA	NA	NA	NA		http://www.ncbi.nlm.nih.gov/gene/?term= 
Regulation of gene expression in late stage (branching morphogenesis) pancreatic bud precursor cells	0	NA	NA	NA	NA		http://www.ncbi.nlm.nih.gov/gene/?term= 
Regulation of Glucokinase by Glucokinase Regulatory Protein	29	2	2.25034985230517	NA	NA	57122;23225	http://www.ncbi.nlm.nih.gov/gene/?term= 57122+23225
Regulation of HSF1-mediated heat shock response	64	8	3.54079122572062	0.417803302225413	0.204743137802878	2932;6119;3312;3313;23225;6117;57805;3297	http://www.ncbi.nlm.nih.gov/gene/?term= 2932+6119+3312+3313+23225+6117+57805+3297
Regulation of Hypoxia-inducible Factor (HIF) by oxygen	25	2	2.75386598469508	NA	NA	3091;112399	http://www.ncbi.nlm.nih.gov/gene/?term= 3091+112399
Regulation of IFNA signaling	20	2	1.98803645997058	NA	NA	7297;5777	http://www.ncbi.nlm.nih.gov/gene/?term= 7297+5777
Regulation of IFNG signaling	0	NA	NA	NA	NA		http://www.ncbi.nlm.nih.gov/gene/?term= 
Regulation of IGF Activity by IGFBP	21	3	1.78476653438008	0.776980138789184	0.246725325470003	3483;354;5069	http://www.ncbi.nlm.nih.gov/gene/?term= 3483+354+5069
Regulation of innate immune responses to cytosolic DNA	13	2	2.41119321862328	NA	NA	23220;6233	http://www.ncbi.nlm.nih.gov/gene/?term= 23220+6233
Regulation of insulin secretion	61	4	2.39549182674888	0.655898540320651	0.240130667139264	6833;5566;3708;5575	http://www.ncbi.nlm.nih.gov/gene/?term= 6833+5566+3708+5575
Regulation of KIT signaling	15	4	1.88537333864233	0.757358219669777	0.246213637102962	2534;5777;3815;4067	http://www.ncbi.nlm.nih.gov/gene/?term= 2534+5777+3815+4067
Regulation of lipid metabolism by Peroxisome proliferator-activated receptor alpha (PPARalpha)	109	14	4.37914297256151	0.267528116774348	0.181554987472434	211;2222;51586;2033;6907;6822;4899;9969;1490;5469;2180;133522;6667;7003	http://www.ncbi.nlm.nih.gov/gene/?term= 211+2222+51586+2033+6907+6822+4899+9969+1490+5469+2180+133522+6667+7003
Regulation of mitotic cell cycle	80	4	5.59198640000408	0.139746350801627	0.138057438390497	5721;26271;4751;701	http://www.ncbi.nlm.nih.gov/gene/?term= 5721+26271+4751+701
Regulation of mRNA stability by proteins that bind AU-rich elements	73	2	3.29733595473867	NA	NA	5687;5721	http://www.ncbi.nlm.nih.gov/gene/?term= 5687+5721
Regulation of necroptotic cell death	11	2	2.927052710073	NA	NA	355;841	http://www.ncbi.nlm.nih.gov/gene/?term= 355+841
Regulation of ornithine decarboxylase (ODC)	46	2	3.29733595473867	NA	NA	5687;5721	http://www.ncbi.nlm.nih.gov/gene/?term= 5687+5721
Regulation of PAK-2p34 activity by PS-GAP/RHG10	0	NA	NA	NA	NA		http://www.ncbi.nlm.nih.gov/gene/?term= 
Regulation of PLK1 Activity at G2/M Transition	76	2	6.46010156982563	NA	NA	4751;10142	http://www.ncbi.nlm.nih.gov/gene/?term= 4751+10142
Regulation of pyruvate dehydrogenase (PDH) complex	14	2	1.62437681449301	NA	NA	5165;1737	http://www.ncbi.nlm.nih.gov/gene/?term= 5165+1737
Regulation of RAS by GAPs	63	2	3.29733595473867	NA	NA	5687;5721	http://www.ncbi.nlm.nih.gov/gene/?term= 5687+5721
Regulation of signaling by CBL	17	2	2.96503620222631	NA	NA	2534;5295	http://www.ncbi.nlm.nih.gov/gene/?term= 2534+5295
Regulation of signaling by NODAL	0	NA	NA	NA	NA		http://www.ncbi.nlm.nih.gov/gene/?term= 
Regulation of TNFR1 signaling	24	3	2.78050318924714	0.566164154103853	0.221629173061748	330;841;7186	http://www.ncbi.nlm.nih.gov/gene/?term= 330+841+7186
Relaxin receptors	0	NA	NA	NA	NA		http://www.ncbi.nlm.nih.gov/gene/?term= 
Release	0	NA	NA	NA	NA		http://www.ncbi.nlm.nih.gov/gene/?term= 
Release of Hh-Np from the secreting cell	0	NA	NA	NA	NA		http://www.ncbi.nlm.nih.gov/gene/?term= 
Removal of aminoterminal propeptides from gamma-carboxylated proteins	0	NA	NA	NA	NA		http://www.ncbi.nlm.nih.gov/gene/?term= 
Removal of licensing factors from origins	69	5	3.41717206706149	0.438382388131132	0.204743137802878	4998;5687;5721;4172;23595	http://www.ncbi.nlm.nih.gov/gene/?term= 4998+5687+5721+4172+23595
Removal of the Flap Intermediate	12	2	2.41827453463142	NA	NA	6119;6117	http://www.ncbi.nlm.nih.gov/gene/?term= 6119+6117
Removal of the Flap Intermediate from the C-strand	0	NA	NA	NA	NA		http://www.ncbi.nlm.nih.gov/gene/?term= 
Repression of WNT target genes	13	2	2.44839003355635	NA	NA	51176;7090	http://www.ncbi.nlm.nih.gov/gene/?term= 51176+7090
Reproduction	10	2	2.38593629817291	NA	NA	5016;11085	http://www.ncbi.nlm.nih.gov/gene/?term= 5016+11085
Resolution of Abasic Sites (AP sites)	27	6	2.732854383486	0.578368030629337	0.223581604942905	6119;5985;10038;6117;2237;5426	http://www.ncbi.nlm.nih.gov/gene/?term= 6119+5985+10038+6117+2237+5426
Resolution of AP sites via the multiple-nucleotide patch replacement pathway	22	2	2.70191742239934	NA	NA	6119;5985	http://www.ncbi.nlm.nih.gov/gene/?term= 6119+5985
Resolution of AP sites via the single-nucleotide replacement pathway	0	NA	NA	NA	NA		http://www.ncbi.nlm.nih.gov/gene/?term= 
Resolution of D-Loop Structures	31	2	3.16386162621732	NA	NA	4683;116028	http://www.ncbi.nlm.nih.gov/gene/?term= 4683+116028
Resolution of D-loop Structures through Holliday Junction Intermediates	30	2	3.16386162621732	NA	NA	4683;116028	http://www.ncbi.nlm.nih.gov/gene/?term= 4683+116028
Resolution of D-loop Structures through Synthesis-Dependent Strand Annealing (SDSA)	25	2	3.16386162621732	NA	NA	4683;116028	http://www.ncbi.nlm.nih.gov/gene/?term= 4683+116028
Resolution of Sister Chromatid Cohesion	100	9	5.42638865495334	0.152428810720268	0.143741777190977	5527;1063;64105;1060;3619;701;55055;9793;55920	http://www.ncbi.nlm.nih.gov/gene/?term= 5527+1063+64105+1060+3619+701+55055+9793+55920
Respiratory electron transport	68	2	4.70305514013016	NA	NA	374291;126328	http://www.ncbi.nlm.nih.gov/gene/?term= 374291+126328
Respiratory electron transport, ATP synthesis by chemiosmotic coupling, and heat production by uncoupling proteins.	84	2	4.70305514013016	NA	NA	374291;126328	http://www.ncbi.nlm.nih.gov/gene/?term= 374291+126328
Response of Mtb to phagocytosis	0	NA	NA	NA	NA		http://www.ncbi.nlm.nih.gov/gene/?term= 
Response to elevated platelet cytosolic Ca2+	0	NA	NA	NA	NA		http://www.ncbi.nlm.nih.gov/gene/?term= 
Retinoid cycle disease events	0	NA	NA	NA	NA		http://www.ncbi.nlm.nih.gov/gene/?term= 
Retinoid metabolism and transport	22	4	3.79941959641836	0.369705671213209	0.199220494065988	4036;3949;26020;344	http://www.ncbi.nlm.nih.gov/gene/?term= 4036+3949+26020+344
Retrograde neurotrophin signalling	12	2	2.06647410408372	NA	NA	1785;161	http://www.ncbi.nlm.nih.gov/gene/?term= 1785+161
Reversal of alkylation damage by DNA dioxygenases	0	NA	NA	NA	NA		http://www.ncbi.nlm.nih.gov/gene/?term= 
Reverse Transcription of HIV RNA	0	NA	NA	NA	NA		http://www.ncbi.nlm.nih.gov/gene/?term= 
Reversible hydration of carbon dioxide	0	NA	NA	NA	NA		http://www.ncbi.nlm.nih.gov/gene/?term= 
Rev-mediated nuclear export of HIV RNA	32	2	2.25034985230517	NA	NA	57122;23225	http://www.ncbi.nlm.nih.gov/gene/?term= 57122+23225
Rhesus glycoproteins mediate ammonium transport.	0	NA	NA	NA	NA		http://www.ncbi.nlm.nih.gov/gene/?term= 
Rho GTPase cycle	111	8	8.14005350159788	0.0141182100981096	0.0308134811712375	10928;6655;58480;158763;84033;29;10395;9824	http://www.ncbi.nlm.nih.gov/gene/?term= 10928+6655+58480+158763+84033+29+10395+9824
RHO GTPase Effectors	226	28	7.46550493474415	0.0279971284996411	0.0505675501081471	1535;387;6093;5527;2017;4637;64130;23081;1063;644150;5585;64105;3895;6249;5879;354;1060;1730;5058;3619;701;11243;29984;9793;10458;71;4771;57591	http://www.ncbi.nlm.nih.gov/gene/?term= 1535+387+6093+5527+2017+4637+64130+23081+1063+644150+5585+64105+3895+6249+5879+354+1060+1730+5058+3619+701+11243+29984+9793+10458+71+4771+57591
RHO GTPases activate CIT	16	3	1.80974306071278	0.771476429767887	0.246213637102962	4637;1742;388	http://www.ncbi.nlm.nih.gov/gene/?term= 4637+1742+388
RHO GTPases Activate Formins	112	14	5.19086718529198	0.17899018904044	0.148534674125885	998;991;1063;64105;1060;3619;701;11243;91010;151246;55055;55920;71;57591	http://www.ncbi.nlm.nih.gov/gene/?term= 998+991+1063+64105+1060+3619+701+11243+91010+151246+55055+55920+71+57591
RHO GTPases activate IQGAPs	11	6	-0.512420093480505	0.998564249820531	0.288395595583886	1495;8826;10788;808;1499;128239	http://www.ncbi.nlm.nih.gov/gene/?term= 1495+8826+10788+808+1499+128239
RHO GTPases activate KTN1	10	2	3.95789077188807	NA	NA	3895;391	http://www.ncbi.nlm.nih.gov/gene/?term= 3895+391
RHO GTPases Activate NADPH Oxidases	11	2	2.14419057090596	NA	NA	1535;50508	http://www.ncbi.nlm.nih.gov/gene/?term= 1535+50508
RHO GTPases activate PAKs	20	3	3.88506896055636	0.352237377363005	0.198396060971008	2017;5058;4771	http://www.ncbi.nlm.nih.gov/gene/?term= 2017+5058+4771
RHO GTPases activate PKNs	43	3	3.02320350183215	0.514237855946399	0.215524911343736	23081;5585;354	http://www.ncbi.nlm.nih.gov/gene/?term= 23081+5585+354
RHO GTPases Activate Rhotekin and Rhophilins	0	NA	NA	NA	NA		http://www.ncbi.nlm.nih.gov/gene/?term= 
RHO GTPases Activate ROCKs	17	2	4.64912225494517	NA	NA	6093;4637	http://www.ncbi.nlm.nih.gov/gene/?term= 6093+4637
RHO GTPases Activate WASPs and WAVEs	34	3	3.93970662415725	0.345058626465662	0.195913047028582	644150;10458;71	http://www.ncbi.nlm.nih.gov/gene/?term= 644150+10458+71
RHO GTPases regulate CFTR trafficking	0	NA	NA	NA	NA		http://www.ncbi.nlm.nih.gov/gene/?term= 
Ribosomal scanning and start codon recognition	47	2	2.85293450803247	NA	NA	3646;27335	http://www.ncbi.nlm.nih.gov/gene/?term= 3646+27335
RIG-I/MDA5 mediated induction of IFN-alpha/beta pathways	73	4	3.62541082107968	0.4015314668581	0.204743137802878	9474;841;23586;84166	http://www.ncbi.nlm.nih.gov/gene/?term= 9474+841+23586+84166
RIPK1-mediated regulated necrosis	15	2	2.927052710073	NA	NA	355;841	http://www.ncbi.nlm.nih.gov/gene/?term= 355+841
RIP-mediated NFkB activation via ZBP1	20	2	1.54073894264806	NA	NA	4790;6288	http://www.ncbi.nlm.nih.gov/gene/?term= 4790+6288
RMTs methylate histone arginines	36	2	2.53199717799109	NA	NA	57492;6595	http://www.ncbi.nlm.nih.gov/gene/?term= 57492+6595
RNA Pol II CTD phosphorylation and interaction with CE	26	2	9.18083481431696	NA	NA	2968;404672	http://www.ncbi.nlm.nih.gov/gene/?term= 2968+404672
RNA Polymerase I Chain Elongation	40	2	10.3537053465534	NA	NA	30834;404672	http://www.ncbi.nlm.nih.gov/gene/?term= 30834+404672
RNA Polymerase II HIV Promoter Escape	40	2	9.18083481431696	NA	NA	2968;404672	http://www.ncbi.nlm.nih.gov/gene/?term= 2968+404672
RNA Polymerase III Abortive And Retractive Initiation	36	4	2.71884303238143	0.581000239291697	0.223581604942905	5451;9328;10302;51082	http://www.ncbi.nlm.nih.gov/gene/?term= 5451+9328+10302+51082
RNA Polymerase III Chain Elongation	16	2	0.907371634876133	NA	NA	661;51082	http://www.ncbi.nlm.nih.gov/gene/?term= 661+51082
RNA Polymerase III Transcription	36	5	2.66611487644619	0.59463986599665	0.225668040711914	55703;5451;9328;6621;10302	http://www.ncbi.nlm.nih.gov/gene/?term= 55703+5451+9328+6621+10302
RNA Polymerase III Transcription Initiation	32	4	2.45969074973794	0.638430246470447	0.235816089533233	5451;9328;11128;10302	http://www.ncbi.nlm.nih.gov/gene/?term= 5451+9328+11128+10302
RNA Polymerase III Transcription Initiation From Type 1 Promoter	25	2	1.96909073945424	NA	NA	9328;51082	http://www.ncbi.nlm.nih.gov/gene/?term= 9328+51082
RNA Polymerase III Transcription Initiation From Type 2 Promoter	24	2	1.96909073945424	NA	NA	9328;51082	http://www.ncbi.nlm.nih.gov/gene/?term= 9328+51082
RNA Polymerase III Transcription Initiation From Type 3 Promoter	25	2	2.438344568599	NA	NA	5451;10302	http://www.ncbi.nlm.nih.gov/gene/?term= 5451+10302
RNA Polymerase III Transcription Termination	20	2	0.907371634876133	NA	NA	661;51082	http://www.ncbi.nlm.nih.gov/gene/?term= 661+51082
RNA Polymerase II Pre-transcription Events	58	2	9.18083481431696	NA	NA	2968;404672	http://www.ncbi.nlm.nih.gov/gene/?term= 2968+404672
RNA Polymerase II Promoter Escape	40	2	7.92289256551931	NA	NA	6878;404672	http://www.ncbi.nlm.nih.gov/gene/?term= 6878+404672
RNA Polymerase II Transcription	97	5	5.93470524128003	0.113663555874611	0.123689143345561	4686;6636;25920;2968;404672	http://www.ncbi.nlm.nih.gov/gene/?term= 4686+6636+25920+2968+404672
RNA Polymerase II Transcription Elongation	41	2	9.18083481431696	NA	NA	2968;404672	http://www.ncbi.nlm.nih.gov/gene/?term= 2968+404672
RNA Polymerase II Transcription Initiation	40	2	9.18083481431696	NA	NA	2968;404672	http://www.ncbi.nlm.nih.gov/gene/?term= 2968+404672
RNA Polymerase II Transcription Initiation And Promoter Clearance	40	2	9.18083481431696	NA	NA	2968;404672	http://www.ncbi.nlm.nih.gov/gene/?term= 2968+404672
RNA Polymerase II Transcription Pre-Initiation And Promoter Opening	40	2	9.18083481431696	NA	NA	2968;404672	http://www.ncbi.nlm.nih.gov/gene/?term= 2968+404672
RNA Polymerase II Transcription Termination	39	2	3.73624725236962	NA	NA	6628;6636	http://www.ncbi.nlm.nih.gov/gene/?term= 6628+6636
RNA Polymerase I Promoter Clearance	58	2	10.3537053465534	NA	NA	30834;404672	http://www.ncbi.nlm.nih.gov/gene/?term= 30834+404672
RNA Polymerase I Promoter Escape	29	2	10.3537053465534	NA	NA	30834;404672	http://www.ncbi.nlm.nih.gov/gene/?term= 30834+404672
RNA Polymerase I Promoter Opening	14	2	0.80611910773899	NA	NA	3015;8349	http://www.ncbi.nlm.nih.gov/gene/?term= 3015+8349
RNA Polymerase I, RNA Polymerase III, and Mitochondrial Transcription	88	2	10.3537053465534	NA	NA	30834;404672	http://www.ncbi.nlm.nih.gov/gene/?term= 30834+404672
RNA Polymerase I Transcription	60	2	10.3537053465534	NA	NA	30834;404672	http://www.ncbi.nlm.nih.gov/gene/?term= 30834+404672
RNA Polymerase I Transcription Initiation	45	2	10.3537053465534	NA	NA	30834;404672	http://www.ncbi.nlm.nih.gov/gene/?term= 30834+404672
RNA Polymerase I Transcription Termination	30	2	10.3537053465534	NA	NA	30834;404672	http://www.ncbi.nlm.nih.gov/gene/?term= 30834+404672
RNF mutants show enhanced WNT signaling and proliferation	0	NA	NA	NA	NA		http://www.ncbi.nlm.nih.gov/gene/?term= 
Role of Abl in Robo-Slit signaling	0	NA	NA	NA	NA		http://www.ncbi.nlm.nih.gov/gene/?term= 
Role of LAT2/NTAL/LAB on calcium mobilization	101	3	7.25930026642833	0.0346972960038287	0.0505675501081471	26281;5295;50852	http://www.ncbi.nlm.nih.gov/gene/?term= 26281+5295+50852
Role of phospholipids in phagocytosis	18	2	4.04455923607491	NA	NA	5335;5581	http://www.ncbi.nlm.nih.gov/gene/?term= 5335+5581
Role of second messengers in netrin-1 signaling	0	NA	NA	NA	NA		http://www.ncbi.nlm.nih.gov/gene/?term= 
RORA activates gene expression	27	6	1.83162713536252	0.767169179229481	0.246213637102962	2033;6907;5469;9572;9575;4862	http://www.ncbi.nlm.nih.gov/gene/?term= 2033+6907+5469+9572+9575+4862
ROS production in response to bacteria	22	2	2.99397784642712	NA	NA	50617;534	http://www.ncbi.nlm.nih.gov/gene/?term= 50617+534
RSK activation	0	NA	NA	NA	NA		http://www.ncbi.nlm.nih.gov/gene/?term= 
S33 mutants of beta-catenin aren't phosphorylated	15	2	3.77877448840644	NA	NA	5527;2932	http://www.ncbi.nlm.nih.gov/gene/?term= 5527+2932
S37 mutants of beta-catenin aren't phosphorylated	15	2	3.77877448840644	NA	NA	5527;2932	http://www.ncbi.nlm.nih.gov/gene/?term= 5527+2932
S45 mutants of beta-catenin aren't phosphorylated	15	2	3.77877448840644	NA	NA	5527;2932	http://www.ncbi.nlm.nih.gov/gene/?term= 5527+2932
Scavenging by Class A Receptors	11	4	0.613765088344756	0.958602536491984	0.279447725338591	4481;1284;1278;7184	http://www.ncbi.nlm.nih.gov/gene/?term= 4481+1284+1278+7184
Scavenging by Class B Receptors	0	NA	NA	NA	NA		http://www.ncbi.nlm.nih.gov/gene/?term= 
Scavenging by Class F Receptors	0	NA	NA	NA	NA		http://www.ncbi.nlm.nih.gov/gene/?term= 
Scavenging by Class H Receptors	0	NA	NA	NA	NA		http://www.ncbi.nlm.nih.gov/gene/?term= 
Scavenging of heme from plasma	0	NA	NA	NA	NA		http://www.ncbi.nlm.nih.gov/gene/?term= 
SCF-beta-TrCP mediated degradation of Emi1	51	2	4.09183240805584	NA	NA	5721;26271	http://www.ncbi.nlm.nih.gov/gene/?term= 5721+26271
SCF(Skp2)-mediated degradation of p27/p21	53	2	3.29733595473867	NA	NA	5687;5721	http://www.ncbi.nlm.nih.gov/gene/?term= 5687+5721
Sema3A PAK dependent Axon repulsion	16	2	2.65436313637914	NA	NA	2534;91584	http://www.ncbi.nlm.nih.gov/gene/?term= 2534+91584
SEMA3A-Plexin repulsion signaling by inhibiting Integrin adhesion	14	2	2.65436313637914	NA	NA	2534;91584	http://www.ncbi.nlm.nih.gov/gene/?term= 2534+91584
Sema4D induced cell migration and growth-cone collapse	23	2	4.64912225494517	NA	NA	6093;4637	http://www.ncbi.nlm.nih.gov/gene/?term= 6093+4637
Sema4D in semaphorin signaling	26	2	4.64912225494517	NA	NA	6093;4637	http://www.ncbi.nlm.nih.gov/gene/?term= 6093+4637
Sema4D mediated inhibition of cell attachment and migration	0	NA	NA	NA	NA		http://www.ncbi.nlm.nih.gov/gene/?term= 
Semaphorin interactions	57	4	5.99886725619089	0.10863843024647	0.122097262478822	2534;6093;1808;3984	http://www.ncbi.nlm.nih.gov/gene/?term= 2534+6093+1808+3984
Senescence-Associated Secretory Phenotype (SASP)	53	5	1.70925058219974	0.793491265853075	0.248794928912753	29945;8697;6195;1051;8349	http://www.ncbi.nlm.nih.gov/gene/?term= 29945+8697+6195+1051+8349
Sensing of DNA Double Strand Breaks	0	NA	NA	NA	NA		http://www.ncbi.nlm.nih.gov/gene/?term= 
Separation of Sister Chromatids	157	12	5.99812128862201	0.108877721943049	0.122097262478822	5527;8697;5687;5721;991;1063;64105;1060;3619;701;9793;55920	http://www.ncbi.nlm.nih.gov/gene/?term= 5527+8697+5687+5721+991+1063+64105+1060+3619+701+9793+55920
Serine biosynthesis	0	NA	NA	NA	NA		http://www.ncbi.nlm.nih.gov/gene/?term= 
Serotonin and melatonin biosynthesis	0	NA	NA	NA	NA		http://www.ncbi.nlm.nih.gov/gene/?term= 
Serotonin Neurotransmitter Release Cycle	17	2	4.56330279299972	NA	NA	6857;8541	http://www.ncbi.nlm.nih.gov/gene/?term= 6857+8541
SHC1 events in EGFR signaling	211	17	8.65636197994905	0.00717875089734386	0.0244400944674431	2534;6710;2255;5527;26281;5687;2335;10142;817;1956;818;115727;6712;2066;2248;200734;4893	http://www.ncbi.nlm.nih.gov/gene/?term= 2534+6710+2255+5527+26281+5687+2335+10142+817+1956+818+115727+6712+2066+2248+200734+4893
SHC1 events in ERBB2 signaling	211	17	8.43401999578436	0.00957166786312515	0.025901187071475	2534;6710;2255;5527;26281;5687;5721;2335;10142;817;1956;818;115727;6712;3265;2248;4763	http://www.ncbi.nlm.nih.gov/gene/?term= 2534+6710+2255+5527+26281+5687+5721+2335+10142+817+1956+818+115727+6712+3265+2248+4763
SHC1 events in ERBB4 signaling	211	17	8.75635942029087	0.00646087580760948	0.0244400944674431	2534;6710;2255;5527;26281;5687;5721;2335;10142;817;1956;818;115727;6712;3265;2248;200734	http://www.ncbi.nlm.nih.gov/gene/?term= 2534+6710+2255+5527+26281+5687+5721+2335+10142+817+1956+818+115727+6712+3265+2248+200734
SHC-mediated cascade:FGFR1	20	2	5.35488954075921	NA	NA	2260;26281	http://www.ncbi.nlm.nih.gov/gene/?term= 2260+26281
SHC-mediated cascade:FGFR2	24	2	5.79745976111839	NA	NA	2263;26281	http://www.ncbi.nlm.nih.gov/gene/?term= 2263+26281
SHC-mediated cascade:FGFR3	16	2	5.77427806067978	NA	NA	2261;26281	http://www.ncbi.nlm.nih.gov/gene/?term= 2261+26281
SHC-mediated cascade:FGFR4	21	2	5.35488954075921	NA	NA	26281;10818	http://www.ncbi.nlm.nih.gov/gene/?term= 26281+10818
SHC-related events triggered by IGF1R	0	NA	NA	NA	NA		http://www.ncbi.nlm.nih.gov/gene/?term= 
Sialic acid metabolism	33	2	1.78591321981939	NA	NA	8128;10559	http://www.ncbi.nlm.nih.gov/gene/?term= 8128+10559
Signal amplification	28	3	1.990369376753	0.737736300550371	0.246213637102962	2792;2770;2787	http://www.ncbi.nlm.nih.gov/gene/?term= 2792+2770+2787
Signal attenuation	0	NA	NA	NA	NA		http://www.ncbi.nlm.nih.gov/gene/?term= 
Signaling by activated point mutants of FGFR1	11	2	5.35488954075921	NA	NA	2260;26281	http://www.ncbi.nlm.nih.gov/gene/?term= 2260+26281
Signaling by activated point mutants of FGFR3	11	2	5.77427806067978	NA	NA	2261;26281	http://www.ncbi.nlm.nih.gov/gene/?term= 2261+26281
Signaling by Activin	12	2	1.74534174210701	NA	NA	130399;4088	http://www.ncbi.nlm.nih.gov/gene/?term= 130399+4088
Signaling by BMP	23	2	2.62464259965932	NA	NA	92;4091	http://www.ncbi.nlm.nih.gov/gene/?term= 92+4091
Signaling by EGFR	313	32	8.46508035311153	0.00909308446996889	0.025901187071475	2534;2255;9462;5527;26281;5687;5721;2549;6711;2335;941;5335;10142;1742;3845;1950;2064;817;5295;818;25780;808;50852;5580;107;161742;5581;115727;5728;6712;2066;2248	http://www.ncbi.nlm.nih.gov/gene/?term= 2534+2255+9462+5527+26281+5687+5721+2549+6711+2335+941+5335+10142+1742+3845+1950+2064+817+5295+818+25780+808+50852+5580+107+161742+5581+115727+5728+6712+2066+2248
Signaling by EGFR in Cancer	18	2	4.35968213487252	NA	NA	5335;1956	http://www.ncbi.nlm.nih.gov/gene/?term= 5335+1956
Signaling by EGFRvIII in Cancer	13	2	4.35968213487252	NA	NA	5335;1956	http://www.ncbi.nlm.nih.gov/gene/?term= 5335+1956
Signaling by ERBB2	298	35	8.27668515198876	0.0126824599186408	0.0308134811712375	2065;6710;5527;26281;2932;5687;5721;208;55914;5924;2335;1385;941;5335;10142;9101;817;5295;1956;818;7316;25780;808;50852;107;5568;5581;115727;6712;2066;2903;2248;5575;200734;4893	http://www.ncbi.nlm.nih.gov/gene/?term= 2065+6710+5527+26281+2932+5687+5721+208+55914+5924+2335+1385+941+5335+10142+9101+817+5295+1956+818+7316+25780+808+50852+107+5568+5581+115727+6712+2066+2903+2248+5575+200734+4893
Signaling by ERBB4	290	25	9.44609868424496	0.0033500837520938	0.0244400944674431	2534;6710;5527;26281;5241;3717;5721;6387;6711;2335;10142;817;5295;1956;50852;8945;115727;6712;3265;5708;25970;2066;51741;2248;200734	http://www.ncbi.nlm.nih.gov/gene/?term= 2534+6710+5527+26281+5241+3717+5721+6387+6711+2335+10142+817+5295+1956+50852+8945+115727+6712+3265+5708+25970+2066+51741+2248+200734
Signaling by FGFR	295	25	9.14390690692852	0.00526441732471883	0.0244400944674431	2534;6710;2255;5527;26281;5687;5721;2335;5335;10142;817;5295;1956;818;808;50852;5580;107;5581;115727;6712;3265;2066;2248;200734	http://www.ncbi.nlm.nih.gov/gene/?term= 2534+6710+2255+5527+26281+5687+5721+2335+5335+10142+817+5295+1956+818+808+50852+5580+107+5581+115727+6712+3265+2066+2248+200734
Signaling by FGFR1	292	24	8.91929678957554	0.00622158411103135	0.0244400944674431	2534;6710;2255;5527;26281;5721;2335;5335;10142;817;1956;818;808;50852;5580;107;5581;115727;5728;6712;3265;2066;2248;200734	http://www.ncbi.nlm.nih.gov/gene/?term= 2534+6710+2255+5527+26281+5721+2335+5335+10142+817+1956+818+808+50852+5580+107+5581+115727+5728+6712+3265+2066+2248+200734
Signaling by FGFR1 fusion mutants	17	2	2.10596701543544	NA	NA	11052;5295	http://www.ncbi.nlm.nih.gov/gene/?term= 11052+5295
Signaling by FGFR1 in disease	35	2	7.77893690392452	NA	NA	26281;5335	http://www.ncbi.nlm.nih.gov/gene/?term= 26281+5335
Signaling by FGFR2	294	24	9.06103171748762	0.00598229241445322	0.0244400944674431	816;6710;2255;5527;26281;5594;5721;6711;2335;5335;10142;3845;817;5295;1956;818;50852;5580;5581;115727;6712;2066;2248;200734	http://www.ncbi.nlm.nih.gov/gene/?term= 816+6710+2255+5527+26281+5594+5721+6711+2335+5335+10142+3845+817+5295+1956+818+50852+5580+5581+115727+6712+2066+2248+200734
Signaling by FGFR2 in disease	25	2	7.77893690392452	NA	NA	26281;5335	http://www.ncbi.nlm.nih.gov/gene/?term= 26281+5335
Signaling by FGFR3	291	45	8.07508250789807	0.0143575017946877	0.0308134811712375	2534;816;6710;2255;9462;108;5527;26281;5720;5594;23112;5687;5721;2254;5518;3718;2335;5335;10142;196883;1742;7094;2064;6233;817;1956;818;25780;808;2905;50852;5580;1849;107;145957;5581;2244;115727;5728;6712;3265;2903;10718;2248;200734	http://www.ncbi.nlm.nih.gov/gene/?term= 2534+816+6710+2255+9462+108+5527+26281+5720+5594+23112+5687+5721+2254+5518+3718+2335+5335+10142+196883+1742+7094+2064+6233+817+1956+818+25780+808+2905+50852+5580+1849+107+145957+5581+2244+115727+5728+6712+3265+2903+10718+2248+200734
Signaling by FGFR3 in disease	20	2	7.77893690392452	NA	NA	26281;5335	http://www.ncbi.nlm.nih.gov/gene/?term= 26281+5335
Signaling by FGFR4	291	32	8.49353895169225	0.00861450107681263	0.025901187071475	6710;2255;5527;26281;5594;5687;5721;2906;6711;2335;5335;10142;3845;7094;1848;817;5295;1956;53358;818;808;50852;5580;1849;107;5581;115727;6712;2066;2903;2248;200734	http://www.ncbi.nlm.nih.gov/gene/?term= 6710+2255+5527+26281+5594+5687+5721+2906+6711+2335+5335+10142+3845+7094+1848+817+5295+1956+53358+818+808+50852+5580+1849+107+5581+115727+6712+2066+2903+2248+200734
Signaling by FGFR4 in disease	10	3	2.90205418342058	0.54223498444604	0.221256235115954	5335;5295;2264	http://www.ncbi.nlm.nih.gov/gene/?term= 5335+5295+2264
Signaling by FGFR in disease	43	2	7.77893690392452	NA	NA	26281;5335	http://www.ncbi.nlm.nih.gov/gene/?term= 26281+5335
Signaling by GPCR	0	NA	NA	NA	NA		http://www.ncbi.nlm.nih.gov/gene/?term= 
Signaling by Hedgehog	117	8	4.80954086352149	0.218234027279253	0.164637363639776	2736;2932;5687;5721;23322;6469;8945;132884	http://www.ncbi.nlm.nih.gov/gene/?term= 2736+2932+5687+5721+23322+6469+8945+132884
Signaling by Hippo	19	2	1.82493603408136	NA	NA	6788;836	http://www.ncbi.nlm.nih.gov/gene/?term= 6788+836
Signaling by Insulin receptor	281	32	8.16135228007334	0.0138789184015315	0.0308134811712375	2534;2065;6710;2255;815;5527;26281;5594;5687;5721;51422;6711;2335;28956;64121;10142;1742;5156;1950;817;1956;25780;7248;3667;145957;3643;115727;6712;3265;2066;2248;200734	http://www.ncbi.nlm.nih.gov/gene/?term= 2534+2065+6710+2255+815+5527+26281+5594+5687+5721+51422+6711+2335+28956+64121+10142+1742+5156+1950+817+1956+25780+7248+3667+145957+3643+115727+6712+3265+2066+2248+200734
